{
  "version": "1.0.0",
  "updated": "2026-05-11",
  "updatedAt": "2026-05-24T23:01:09.778031+00:00",
  "sourceRepo": "https://github.com/yu200512/ai-model-pricing",
  "providers": [
    {
      "name": "DeepSeek",
      "id": "deepseek",
      "category": "国内",
      "currency": "USD",
      "dataSource": {
        "url": "https://api-docs.deepseek.com/quick_start/pricing",
        "method": "curl",
        "verifiedAt": "2026-05-24T23:01:09.768419+00:00"
      },
      "officialUrl": "https://api-docs.deepseek.com/quick_start/pricing",
      "models": [
        {
          "name": "输入（缓存命中）",
          "type": "text",
          "modalities": [
            "text"
          ],
          "capabilities": [],
          "pricing": [
            {
              "contextRange": {
                "min": 0,
                "description": "未注明"
              },
              "unit": "per_1m_tokens",
              "currency": "USD",
              "unified": 0.0
            },
            {
              "contextRange": {
                "min": 0,
                "description": "未注明"
              },
              "unit": "per_1m_tokens",
              "currency": "USD",
              "unified": 0.0
            }
          ],
          "notes": "DeepSeek-V4-Flash"
        },
        {
          "name": "输入（缓存未命中）",
          "type": "text",
          "modalities": [
            "text"
          ],
          "capabilities": [],
          "pricing": [
            {
              "contextRange": {
                "min": 0,
                "description": "未注明"
              },
              "unit": "per_1m_tokens",
              "currency": "USD",
              "unified": 0.0,
              "notes": "输入（缓存未命中） $0.14"
            },
            {
              "contextRange": {
                "min": 0,
                "description": "未注明"
              },
              "unit": "per_1m_tokens",
              "currency": "USD",
              "unified": 0.0,
              "notes": "输入（缓存未命中） $0.435 $1.74"
            }
          ],
          "notes": "DeepSeek-V4-Flash"
        },
        {
          "name": "输出",
          "type": "text",
          "modalities": [
            "text"
          ],
          "capabilities": [],
          "pricing": [
            {
              "contextRange": {
                "min": 0,
                "description": "未注明"
              },
              "unit": "per_1m_tokens",
              "currency": "USD",
              "unified": 0.0
            },
            {
              "contextRange": {
                "min": 0,
                "description": "未注明"
              },
              "unit": "per_1m_tokens",
              "currency": "USD",
              "unified": 0.0
            }
          ],
          "notes": "DeepSeek-V4-Flash"
        }
      ]
    },
    {
      "name": "智谱AI（Z.ai）",
      "id": "zhipu",
      "category": "国内",
      "currency": "CNY",
      "dataSource": {
        "url": "https://open.bigmodel.cn/pricing",
        "method": "curl",
        "verifiedAt": "2026-05-24T23:01:09.769517+00:00"
      },
      "officialUrl": "https://open.bigmodel.cn/pricing",
      "models": [
        {
          "name": "GLM-5.1",
          "type": "text",
          "modalities": [
            "text"
          ],
          "capabilities": [],
          "pricing": [
            {
              "contextRange": {
                "min": 0,
                "description": "—"
              },
              "unit": "per_1m_tokens",
              "currency": "CNY",
              "input": 6.0,
              "output": 24.0,
              "cacheHit": 1.3,
              "notes": "GLM-5.1 [0, 32K) — ¥6 ¥24 ¥1.3"
            }
          ],
          "notes": "2.1 旗舰文本模型"
        },
        {
          "name": "GLM-5-Turbo",
          "type": "text",
          "modalities": [
            "text"
          ],
          "capabilities": [],
          "pricing": [
            {
              "contextRange": {
                "min": 0,
                "description": "—"
              },
              "unit": "per_1m_tokens",
              "currency": "CNY",
              "input": 5.0,
              "output": 22.0,
              "cacheHit": 1.2,
              "notes": "GLM-5-Turbo [0, 32K) — ¥5 ¥22 ¥1.2"
            }
          ],
          "notes": "2.1 旗舰文本模型"
        },
        {
          "name": "GLM-5",
          "type": "text",
          "modalities": [
            "text"
          ],
          "capabilities": [],
          "pricing": [
            {
              "contextRange": {
                "min": 0,
                "description": "—"
              },
              "unit": "per_1m_tokens",
              "currency": "CNY",
              "input": 4.0,
              "output": 18.0,
              "cacheHit": 1.0,
              "notes": "GLM-5 [0, 32K) — ¥4 ¥18 ¥1"
            }
          ],
          "notes": "2.1 旗舰文本模型"
        },
        {
          "name": "GLM-4.7",
          "type": "text",
          "modalities": [
            "text"
          ],
          "capabilities": [],
          "pricing": [
            {
              "contextRange": {
                "min": 0,
                "description": "[0, 0.2K)",
                "max": 200
              },
              "unit": "per_1m_tokens",
              "currency": "CNY",
              "input": 2.0,
              "output": 8.0,
              "cacheHit": 0.0
            }
          ],
          "notes": "2.1 旗舰文本模型"
        },
        {
          "name": "GLM-4.5-Air",
          "type": "text",
          "modalities": [
            "text"
          ],
          "capabilities": [],
          "pricing": [
            {
              "contextRange": {
                "min": 0,
                "description": "[0, 0.2K)",
                "max": 200
              },
              "unit": "per_1m_tokens",
              "currency": "CNY",
              "input": 0.0,
              "output": 2.0,
              "cacheHit": 0.0
            },
            {
              "contextRange": {
                "min": 0,
                "description": "未注明"
              },
              "unit": "per_1k_tokens",
              "currency": "CNY",
              "unified": 4.5
            }
          ],
          "notes": "2.1 旗舰文本模型"
        },
        {
          "name": "GLM-4.7-FlashX",
          "type": "text",
          "modalities": [
            "text"
          ],
          "capabilities": [],
          "pricing": [
            {
              "contextRange": {
                "min": 0,
                "description": "—"
              },
              "unit": "per_1m_tokens",
              "currency": "CNY",
              "input": 0.0,
              "output": 3.0,
              "cacheHit": 0.0,
              "notes": "GLM-4.7-FlashX 200K — ¥0.5 ¥3 ¥0.1"
            }
          ],
          "contextLength": 200000,
          "notes": "2.1 旗舰文本模型"
        },
        {
          "name": "GLM-4.7-Flash",
          "type": "text",
          "modalities": [
            "text"
          ],
          "capabilities": [],
          "pricing": [
            {
              "contextRange": {
                "min": 0,
                "description": "—"
              },
              "unit": "per_1m_tokens",
              "currency": "CNY",
              "input": 0.0,
              "output": 0.0,
              "cacheHit": 0.0,
              "notes": "GLM-4.7-Flash 200K — 免费 免费 免费"
            }
          ],
          "contextLength": 200000,
          "free": true,
          "notes": "2.1 旗舰文本模型"
        },
        {
          "name": "GLM-5V-Turbo",
          "type": "video",
          "modalities": [
            "text",
            "image",
            "video"
          ],
          "capabilities": [],
          "pricing": [
            {
              "contextRange": {
                "min": 0,
                "description": "[0, 32K)",
                "max": 32000
              },
              "unit": "per_call",
              "currency": "CNY",
              "input": 5.0,
              "output": 22.0,
              "cacheHit": 1.2
            }
          ],
          "notes": "2.2 旗舰视觉模型"
        },
        {
          "name": "GLM-4.6V",
          "type": "video",
          "modalities": [
            "text",
            "image",
            "video"
          ],
          "capabilities": [],
          "pricing": [
            {
              "contextRange": {
                "min": 0,
                "description": "[0, 32K)",
                "max": 32000
              },
              "unit": "per_call",
              "currency": "CNY",
              "input": 1.0,
              "output": 3.0,
              "cacheHit": 0.0
            }
          ],
          "notes": "2.2 旗舰视觉模型"
        },
        {
          "name": "GLM-4.6V-FlashX",
          "type": "video",
          "modalities": [
            "text",
            "image",
            "video"
          ],
          "capabilities": [],
          "pricing": [
            {
              "contextRange": {
                "min": 0,
                "description": "[0, 32K)",
                "max": 32000
              },
              "unit": "per_call",
              "currency": "CNY",
              "input": 0.0,
              "output": 1.5,
              "cacheHit": 0.0
            }
          ],
          "notes": "2.2 旗舰视觉模型"
        },
        {
          "name": "GLM-4.6V-Flash",
          "type": "video",
          "modalities": [
            "text",
            "image",
            "video"
          ],
          "capabilities": [],
          "pricing": [
            {
              "contextRange": {
                "min": 0,
                "description": "—"
              },
              "unit": "per_call",
              "currency": "CNY",
              "input": 0.0,
              "output": 0.0,
              "cacheHit": 0.0,
              "notes": "GLM-4.6V-Flash — 免费 免费 免费 图片/视频/文件/文本"